{
  "schema_version": "1.0",
  "document_type": "ux_feature_contract",
  "feature_id": "uxf-guided-error-recovery",
  "slug": "guided-error-recovery",
  "title": "Guided Error Recovery",
  "status": "ready_for_implementation",
  "generated_from": {
    "project": "Example collaborative task application",
    "requested_focus": "Reduce abandonment when saving a task fails",
    "evidence": [
      {
        "id": "ev-01",
        "type": "repository",
        "source": "src/features/tasks/TaskEditor.tsx",
        "observation": "The task editor exposes a generic save failure message with no preserved recovery action.",
        "relevance": "Users cannot tell whether their draft is safe or how to complete the interrupted job."
      },
      {
        "id": "ev-02",
        "type": "support",
        "source": "Supplied issue summary: save failures",
        "observation": "Users report retyping task details after intermittent save failures.",
        "relevance": "The failure creates repeated work and undermines trust in the editor."
      },
      {
        "id": "ev-03",
        "type": "repository",
        "source": "src/lib/drafts/localDraftStore.ts",
        "observation": "A local draft store already supports temporary persistence for unsent content.",
        "relevance": "The existing persistence seam can support recovery without a new storage subsystem."
      },
      {
        "id": "ev-04",
        "type": "assumption",
        "source": "Product inference",
        "observation": "Task creation is likely a frequent workflow for active collaborators.",
        "relevance": "Frequency increases the potential value, but analytics should confirm the assumption."
      }
    ]
  },
  "decision": {
    "selected_candidate_id": "cand-01",
    "selection_rationale": "Guided recovery directly protects user work, reuses an existing draft seam, and provides a measurable reduction in failed-save abandonment without expanding the core task model.",
    "candidates": [
      {
        "id": "cand-01",
        "title": "Guided Error Recovery",
        "problem": "Users lose confidence and may repeat work when a task save fails without a clear recovery path.",
        "target_user": "Collaborators creating or editing tasks",
        "evidence_refs": [
          "ev-01",
          "ev-02",
          "ev-03"
        ],
        "measurable_outcome": "Reduce abandoned task edits after save failures.",
        "vertical_slice": "Preserve the draft, explain the failure, and let the user retry or copy the content from the same editor.",
        "duplication_check": "The application has draft storage but no guided recovery experience connected to save failures.",
        "minimum_gates": {
          "concrete_problem": true,
          "distinct": true,
          "measurable": true,
          "end_to_end_mvp": true,
          "constraint_compatible": true
        },
        "scores": {
          "user_pain": 4.5,
          "frequency_or_reach": 4,
          "ux_leverage": 4.5,
          "strategic_fit": 4,
          "evidence_confidence": 4,
          "implementation_feasibility": 4,
          "differentiation": 3.5
        },
        "risk_penalty": 5,
        "total_score": 79,
        "disposition": "selected"
      },
      {
        "id": "cand-02",
        "title": "First-Task Guided Tour",
        "problem": "New users may not understand how task assignment, due dates, and collaboration fit together.",
        "target_user": "First-time workspace members",
        "evidence_refs": [
          "ev-04"
        ],
        "measurable_outcome": "Increase successful first-task completion during the first session.",
        "vertical_slice": "Show contextual guidance during the first task creation and dismiss it after completion.",
        "duplication_check": "No supplied evidence identifies an existing contextual onboarding flow.",
        "minimum_gates": {
          "concrete_problem": true,
          "distinct": true,
          "measurable": true,
          "end_to_end_mvp": true,
          "constraint_compatible": true
        },
        "scores": {
          "user_pain": 3,
          "frequency_or_reach": 3.5,
          "ux_leverage": 3.5,
          "strategic_fit": 3.5,
          "evidence_confidence": 1.5,
          "implementation_feasibility": 4,
          "differentiation": 2.5
        },
        "risk_penalty": 5,
        "total_score": 58.5,
        "disposition": "deferred"
      },
      {
        "id": "cand-03",
        "title": "Bulk Task Editing",
        "problem": "Users managing many tasks may repeat the same update across multiple records.",
        "target_user": "Project leads managing large boards",
        "evidence_refs": [
          "ev-04"
        ],
        "measurable_outcome": "Reduce time spent applying shared task changes.",
        "vertical_slice": "Select multiple tasks and update one supported field with a review step.",
        "duplication_check": "No bulk-edit behavior appears in the supplied evidence, but repository verification is incomplete.",
        "minimum_gates": {
          "concrete_problem": true,
          "distinct": true,
          "measurable": true,
          "end_to_end_mvp": true,
          "constraint_compatible": true
        },
        "scores": {
          "user_pain": 3.5,
          "frequency_or_reach": 3,
          "ux_leverage": 4,
          "strategic_fit": 3.5,
          "evidence_confidence": 1.5,
          "implementation_feasibility": 2.5,
          "differentiation": 3
        },
        "risk_penalty": 9,
        "total_score": 55.0,
        "disposition": "deferred"
      },
      {
        "id": "cand-04",
        "title": "Workspace Activity Digest",
        "problem": "Returning collaborators may struggle to identify meaningful changes since their previous session.",
        "target_user": "Collaborators returning to active workspaces",
        "evidence_refs": [
          "ev-04"
        ],
        "measurable_outcome": "Reduce time from return to first relevant action.",
        "vertical_slice": "Summarize assigned, mentioned, completed, and overdue changes in a dismissible panel.",
        "duplication_check": "No digest capability is present in the supplied evidence, but event availability requires verification.",
        "minimum_gates": {
          "concrete_problem": true,
          "distinct": true,
          "measurable": true,
          "end_to_end_mvp": true,
          "constraint_compatible": true
        },
        "scores": {
          "user_pain": 3.5,
          "frequency_or_reach": 3.5,
          "ux_leverage": 3.5,
          "strategic_fit": 4,
          "evidence_confidence": 1.5,
          "implementation_feasibility": 2.5,
          "differentiation": 3.5
        },
        "risk_penalty": 8,
        "total_score": 57.5,
        "disposition": "deferred"
      },
      {
        "id": "cand-05",
        "title": "Task Template Gallery",
        "problem": "Users may repeatedly recreate common task structures and checklists.",
        "target_user": "Teams with recurring operational work",
        "evidence_refs": [
          "ev-04"
        ],
        "measurable_outcome": "Reduce inputs required to create recurring task types.",
        "vertical_slice": "Offer a small user-owned template list at task creation with create, apply, and delete actions.",
        "duplication_check": "No template behavior is identified in the supplied evidence, but demand is unverified.",
        "minimum_gates": {
          "concrete_problem": true,
          "distinct": true,
          "measurable": true,
          "end_to_end_mvp": true,
          "constraint_compatible": true
        },
        "scores": {
          "user_pain": 2.5,
          "frequency_or_reach": 3,
          "ux_leverage": 3,
          "strategic_fit": 3.5,
          "evidence_confidence": 1.5,
          "implementation_feasibility": 3,
          "differentiation": 2.5
        },
        "risk_penalty": 6,
        "total_score": 49.5,
        "disposition": "rejected"
      }
    ]
  },
  "problem": {
    "statement": "When saving a task fails, collaborators receive a generic error without knowing whether their draft is preserved or what action will safely complete the save.",
    "affected_users": [
      "Collaborators creating tasks",
      "Collaborators editing existing tasks"
    ],
    "jobs_to_be_done": [
      "Save task changes without losing entered content",
      "Recover from a transient failure without restarting the workflow"
    ],
    "current_friction": [
      "The failure message does not explain whether content is safe",
      "The editor does not expose retry or copy actions next to the failure",
      "Users may retype content or abandon the edit"
    ],
    "evidence_refs": [
      "ev-01",
      "ev-02",
      "ev-03"
    ]
  },
  "outcomes": {
    "user_value": "Users retain control of their work and can complete the save without re-entering task content.",
    "product_value": "The product reduces abandonment and support burden while increasing trust in a core workflow.",
    "metrics": [
      {
        "id": "metric-01",
        "name": "Failed-save recovery rate",
        "kind": "primary",
        "definition": "Percentage of task save failures followed by a successful retry for the same draft within ten minutes.",
        "baseline": "unknown",
        "target": "Increase after rollout, with a target set after baseline collection",
        "instrumentation": "Correlate task_save_failed and task_save_recovered by anonymous draft attempt identifier.",
        "review_window": "Four weeks after general availability",
        "guardrail": "Do not increase duplicate task creation or repeated save requests."
      },
      {
        "id": "metric-02",
        "name": "Draft loss reports",
        "kind": "guardrail",